{
  "trading_date": "2026-07-18",
  "market_timestamp": "2026-07-18T09:30:00+07:00",
  "update_period": "MORNING",
  "currency": "IDR",
  "data_available": true,
  "open": 2800,
  "high": 2850,
  "low": 2780,
  "last": 2830,
  "close": null,
  "previous_close": 2780,
  "average": 2815,
  "change": 50,
  "change_percentage": "1.80",
  "volume": 15000000,
  "transaction_value": 42000000000,
  "best_bid": 2820,
  "best_offer": 2830,
  "spread": 10,
  "spread_percentage": "0.35",
  "summary": "Pasar bergerak positif pada sesi pagi.",
  "source": "MIXED",
  "limitations": []
}